course_code,course_link,course_name,overall,prof_rating,difficulty,workload,professors,comments,tips
ME-411,https://edu.epfl.ch/studyplan/en/master/mechanical-engineering/coursebook/mechanics-of-slender-structures-ME-411,Mechanics of slender structures,4 (1),5.0,4.0,3 (5),[],"['It is a good advanced structural mechanics course that goes over rod, plate and shell mechanics. Some concepts are hard to understand but putting in the work it can be done.']",['Follow all the lectures and do the exercises. It is important to ask questions to the professor if needed.']
ME-413,https://edu.epfl.ch/studyplan/en/master/mechanical-engineering/coursebook/introduction-to-additive-manufacturing-ME-413,Introduction to additive manufacturing,4 (1),4.0,2.0,4 (3),"['Boillat', 'Brugger', 'Moser']",['The course is easy and interesting. The content is pretty strait forward but nevertheless interesting.'],['The pdf print available to be bought is very useful both for learning and the exam']
ME-419,https://edu.epfl.ch/studyplan/en/master/management-technology-and-entrepreneurship/coursebook/production-management-ME-419,Production management,4 (6),3.8,3.0,4.2 (5),['Kaboli'],"['Very useful course, appreciated in industry. I recommend\n*sourced from the web', 'Did not regret taking it in Elective block\n*sourced from the web', ""I don't like the style of the class but it seems very appreciated in industry and you can meet a lot of important people."", 'I recommend the course, the content is interesting, a lot of speakers come to the class, you learn a lot about industry so the course is really an insight into professional world however the professor is sometimes a bit hard with the students and the workload is quite high (around 4 to 6h of work every week is needed to prepare the reports).', 'Very interesting course. The workload is quite important since you have quasi weekly assignments.', 'Very involving course that deals with topics not taught in any other courses. You will be involved in the course by working in a group on a practical project about a certain product/company, and this will be the basis of your evaluation. However, the course is demanding (about 10 hours per week) and presence is mandatory (Friday afternoon...). Also there are a lot of guest speakers from industry, sometimes very interesting and sometimes less, but it offers great possibilities to get an internship in this field.']","['Super interesting but takes a LOT of time. But the grades are rather good\n*sourced from the web', 'Listen to the professor, be present a lot in class.', 'Presence to class is mandatory, you must also read the slides every week, be prepared for the amount of work.', 'Presentation is key so pay attention to details and how you present (orally and the assignments)', 'Organize yourself immediately within your group and motivate everyone. Rapidly organize your Excel sheet so that everything is clear to work on it and advance in the course.']"
ME-421,https://edu.epfl.ch/studyplan/en/master/mechanical-engineering/coursebook/system-identification-ME-421,System identification,4 (2),3.5,3.5,3 (3),['Karimi'],"[""This course explores various identification techniques for creating models of dynamic systems, which are then applied to controller design. In my opinion, it's an excellent course for all engineering students because it demonstrates how to derive simple models of complex real-world dynamic systems. The professor is excellent, offering clear explanations on the blackboard and providing helpful examples when needed."", 'While doing this course I felt it was bad organized since the goal of this course is not very clear. I would have liked to have better real case studies. Because it really felt like applying something I didn t understand its purpose. Even if it is 3 credits it felt like 4.']","[""Completing the computer exercises is crucial in this course because they help you grasp all the concepts by applying them to practical examples. There is a multiple-choice question section on the exam, so it's important to have a solid understanding of the theory. Attendance is mandatory, as no videos are available for this course."", 'Go to the lectures simce there are no videos. Do the graded reports, etc']"
ME-422,https://edu.epfl.ch/studyplan/en/master/mechanical-engineering/coursebook/multivariable-control-ME-422,Multivariable control,3.5 (2),4.5,3.0,4 (4),['Ferrari Trecate'],"['This course goes through a lot of content in controls. The workload is much higher than 4 credits IMO. There are two weekly exercises, one on Matlab and one on pen and paper. 3 quizzes in the semester that are similar to the Matlab exercises so do those.', 'This course covers all the essential topics of multivariable control, along with some advanced concepts. It will enhance your understanding of other control theory areas and strengthen your intuition through detailed MATLAB simulation exercises.']","[""Do the exercises. Lectures were recorded so you don't need to go to class if you don't want to."", 'This course demands a significant time commitment, with two weekly exercise sheets that can be very time-consuming if completed without the provided solutions.']"
ME-425,https://edu.epfl.ch/studyplan/en/master/electrical-and-electronics-engineering/coursebook/model-predictive-control-ME-425,Model predictive control,3.7 (6),4.0,4.5,3.2 (4),['Jones'],"['I do not recommend this course. I did a mistake by taking it but i passed somehow.', 'The course was really interesting, if you know matlab and basics of control theory (State Space) you should be fine. Still a challenging exam.', ""Yes, probably one of my favourite courses so far! A bit biased though having prior knowledge in both control theory and optimization, making the covered topics not as painful as they could have been. If you don't have any prior knowledge in these areas, this course is definitely going to be challenging. However, the professor (Colin) is great, in my opinion,and the exercises and mini project are interesting and highly linked to whats covered in the lectures. The staff, in general, is helpful during exercise lectures"", 'The course content is interesting and it is taught well. I enjoyed the project a lot and the exercises were helpful to help understand the course.', 'Good lectures and good teacher. The exercices are good but for the project only ! Exam is harsh but grade are really OK/good. Course is not hard, just the exam not really adapted', ""A lot to cover in the semester so very hard to follow if you don t have very strong basis on control theory (example multivariable control helps a lot). But still very doable to pass without understanding a lot haha since the project is very similar to exercises and the exam's grades are inflated""]","['Make a good project it will save you for the written exam. The written exam is impossible IMO', ""Don't be late on the exercises, they're really doable in 4hours and super useful for the project."", ""You really have to focus during the lectures in order to keep up with the professor, even though he's good at explaining. If you feel you're not able to keep up with the live lecture, you can watch an equivalent youtube series the prof has made. Exercise lectures is most likely placed right after the normal lectures. Highly recommend using that time to do the exercises, the exercise is linked to whats just been covered in the lecture so you have that fresh in mind, and also easy to get good help from the teaching staff."", ""The exam is extremely, EXTREMELY difficult and there's no good way to go about preparing for it. To do well on the project do the exercises and ask questions during the time you have in class."", ""Do the exercice and start the project early. Unfortunetely, you cannot really prepare for the written exam but I'm pretty sure that the teacher is REALLY generous with the grades. Just do a good project and it will help you pass"", 'do the project as soon as possible so you can ask the teacher as many qustions as you need, he is really good to find your errors The exam is one of the hardest I did at EPFL but everyone do so badly they have to grade it veeeery nicely']"
ME-426,https://edu.epfl.ch/studyplan/en/master/mechanical-engineering/coursebook/micro-nanomechanical-devices-ME-426,Micro/Nanomechanical devices,4.5 (2),4.5,1.5,1 (4),['Villanueva Torrijo'],"['Easy course for a meca. You work on paper during the semester.', 'stronly recommend! reading papers and asking questions are the only homework but count for half of the final score,']","['You need to take notes during the class. You need to go in lecture and ask questions.', 'good to go to the class, even if students have recording but not that clear']"
ME-427,https://edu.epfl.ch/studyplan/en/master/electrical-and-electronics-engineering/coursebook/networked-control-systems-ME-427,Networked control systems,4.3 (3),4.7,2.7,2.7 (3),['Ferrari Trecate'],"['Of course I recommend it. (To be known I really love control theory). This course is the theory behind network control systems this is a lot of definitions properties theorems that you have to link together to understand the concepts. I know that few of you did it but of some people who went to KTH in exchange it has some common ground with hybrid and Embedded systems.', 'great stuff, the first part delves into the non idealities of networks such as delays in the control loop, quantizations, dropouts etc... It is all very interesting in order to get a sense on how to implement controllers in a bit of a more realistic environment. The second part focuses really on controlling distributed systems, which is interesting but it all feels a little disconnected from practical uses...', ""This course is highly engaging if you're interested in control theory, graph theory, and consensus.""]","[""I've read the slides every week and when I had questions I asked them to the professor. The exercice sessions are really useful to understand what we are doing."", 'can skip classes as its word for word the same class as in covid years, which were recorded and still available on switch tube', ""The only prerequisite for this course is a bachelor's level understanding of control theory. The exercises offer valuable practice, and the provided course videos are sufficient to help you pass.""]"
ME-435,https://edu.epfl.ch/studyplan/en/master/mechanical-engineering/coursebook/aeroelasticity-and-fluid-structure-interaction-ME-435,Aeroelasticity and fluid-structure interaction,5 (1),5.0,2.0,1 (3),['Farhat'],['I recommend this course. You learn both fluids and mechanics things.'],['Learn the math and the knowledge things. You need to understand the phenomena also for the written exam.']
ME-444,https://edu.epfl.ch/studyplan/en/master/computational-science-and-engineering/coursebook/hydrodynamics-ME-444,Hydrodynamics,3 (1),4.0,5.0,3 (5),['Gallaire'],"[""I would not recommend this course if you're not passionate about fluid mechanics. Very theoretical and hard exam. The homeworks are rather easy.""]","['Exercise as much as you can before the exam, especially be at ease with your math (eg integrals, derivatives, gradients,...)']"
ME-445,https://edu.epfl.ch/studyplan/en/master/mechanical-engineering/coursebook/aerodynamics-ME-445,Aerodynamics,2 (1),1.0,3.0,3 (4),['Mulleners'],['I would recommend to do an aerodynamic class but this course is not well taught.'],['Work hard during the project to understand the main concepts to succeed the exam.']
ME-451,https://edu.epfl.ch/studyplan/en/master/energy-science-and-technology/coursebook/advanced-energetics-ME-451,Advanced energetics,4 (1),4.0,3.0,4 (5),['Maréchal'],['Very good course that mixes economics and energy systems. The course comes with a project that applies what you see in course. I recommend taking this course with Modelling of Energy Systems as have a lot of stuff in common and this helps for the final exam'],"['The course is somewhat difficult for some aspects, so it is very recommendable to go to the lectures to have the chance to ask questions.']"
ME-453,https://edu.epfl.ch/studyplan/en/master/energy-science-and-technology/coursebook/hydraulic-turbomachines-ME-453,Hydraulic turbomachines,5 (1),5.0,2.0,3 (4),"['Avellan', 'Vagnoni']","['Very nice course to get to know the different types of hydraulic turbines, as well as, how to choose and dimension them. The exercises are understandable and the exam looks very similar to the exercises.']","['Going to the lectures is not that necessary but it is important to know the theory like how to compute the specific energy or what the velocity triangle represents. Appart from that, just do the series and you will be ready for the final exam']"
ME-454,https://edu.epfl.ch/studyplan/en/master/chemical-engineering-and-biotechnology/coursebook/modelling-and-optimization-of-energy-systems-ME-454,Modelling and optimization of energy systems,5 (1),4.0,3.0,3 (4),['Maréchal'],"['Good course that shows how energy systems are modeled. The theory seen in course is better illustrated by the project that is done in parallel. It is very recommendable to take in the same semester Advanced Energetics as the topics are very similar, and this is useful for the final exam. The oral can get tricky very fast if you have not understood the whole project or if you are lacking something in terms of theory']","[""It is important to keep up to date the project as at the end you will need to do many simulations that even if don't take a lot of time, it is better to do them on a code that is running 100% of the time. The oral exam at the end covers nearly everything so you should be prepared to answer questions on all topics. The questions might not be obvious so you should know the stuff, it is not impossible tho""]"
ME-460,https://edu.epfl.ch/studyplan/en/master/energy-science-and-technology/coursebook/renewable-energy-for-me-ME-460,Renewable energy (for ME),3 (2),2.5,2.5,3 (4),"['Haussener', 'Van Herle']","[""It's a good course to get a surface level knowledge on a few renewable energy sources."", 'Good course to know the basics about most renewable energy. But alooooot of ""semi-interesting"" content. Especially in Prof. Haussener\'s part (usually +70 slides per course). This makes it tedious to review. But most exercises are not difficult.']","[""The lectures are mostly boring and take a long time to reach the part that is important (the teacher passes a lot of time showing graphs or estimation that aren't very related with the topic). Do the series and prepare a good summary for the exam"", 'The exam is rather long, so you need to be quick on computations. 10 pages A4 summary is quite annoying to prepare, but can be useful during the exam for answering ""general knowledge"" questions']"
ME-462,https://edu.epfl.ch/studyplan/en/master/mechanical-engineering/coursebook/cavitation-and-interface-phenomena-ME-462,Cavitation and interface phenomena,4.3 (3),4.3,2.0,1.3 (3),['Farhat'],"['Good course to learn about cavitation, how to recreate it and what are its effects. Be careful in the oral exam', 'I recommend this class. Not a lot of fluid mechanics but you need the basis.', ""I found this course very interesting as the professor is passionate of the subject. I didn't know cavitation was such a big subject in fluid mechanics.""]","[""The exercises are optional as they are useless, however in the oral exam the teacher doesn't go through all the different types of cavitation, he just sticks to the one question you got."", 'Be carefull with the oral exam. you dont have exercices during the semester but you need to understand almost everything for the oral exam.', ""Don't spend too much time on the exercises but try to really understand the course with the help of the assistant. For the oral exam, you really need to know every subject discussed during the semester.""]"
ME-464,https://edu.epfl.ch/studyplan/en/master/mechanical-engineering/coursebook/introduction-to-nuclear-engineering-ME-464,Introduction to nuclear engineering,4 (1),5.0,3.0,2 (2),['Fiorina'],"[""I would definitely recommend this course ! You learn a lot and the exam is easy if you've understood the course.""]",['Prepare all the questions given during the exam review session.']
ME-466,https://edu.epfl.ch/studyplan/en/master/computational-science-and-engineering/coursebook/instability-ME-466,Instability,4 (1),3.0,4.0,3 (3),['Gallaire'],['Requires some basic knowledge fluid mechanics but is very interesting. Lots of computations and maths'],"['Easier if you come to class, the exercises are mandatory to understand to methods']"
ME-467,https://edu.epfl.ch/studyplan/en/master/computational-science-and-engineering/coursebook/turbulence-ME-467,Turbulence,3 (1),4.0,5.0,5 (5),['Schneider'],"[""I would not recommend this course, if you don't have to, don't take it. Very, very theoretical and the classes are hard to follow as they are 4 hours of blackboard equations.""]","[""Start the project as soon as you can and find a good group to do it with: you won't be able to do it by yourself.""]"
ME-474,https://edu.epfl.ch/studyplan/en/master/computational-science-and-engineering/coursebook/numerical-flow-simulation-ME-474,Numerical flow simulation,4.2 (4),4.2,2.5,1.8 (5),['Boujo'],"['Highly recommend however knowledge of fluid is needed. Use of MATLAB and Fluent, knowing MATLAB is an advantage and Fluent you will learn during the semester.', 'Really easy 5ects, It wasnt particularly interesting for me, but if you like CFD simulation It will be the perfect class for you.', 'Really easy 5ects, It wasnt particularly interesting for me, but if you like CFD simulation It will be the perfect class for you.', '2 projects (MATLAB and Fluent). Quite easy overall just make sure you have a good group.']","['1 MATLAB project and 1 Fluent project (50% each) No final', 'Didnt go to any course and I would recommend to find a good partner for your projects. The groupcould be up to 4 people, but I ended up doing It with only one person and It was fine.', 'Didnt go to any course and I would recommend to find a good partner for your projects. The groupcould be up to 4 people, but I ended up doing It with only one person and It was fine.', 'Have a good group and start working on the projects ASAP (This will give you more time with TAs)']"
ME-480,https://edu.epfl.ch/studyplan/en/master/life-sciences-engineering/coursebook/mechanobiology-how-mechanics-regulate-life-ME-480,Mechanobiology: how mechanics regulate life,4 (1),5.0,4.0,3 (3),"['Persat', 'Sakar']","['Yes, good class. But this year 3 mini project and he is increasing it each year.']",['For mini projects good group is required. For article presentation its easy and again group wrok.']
ME-481,https://edu.epfl.ch/studyplan/en/master/life-sciences-engineering/coursebook/biomechanics-of-the-cardiovascular-system-ME-481,Biomechanics of the cardiovascular system,4.5 (2),5.0,2.0,2.5 (3),['Stergiopulos'],"['The class if very interesting, the course is well structured. The exercises help to understand the concepts. The exam is not too hard if you studied the classes and did the exercises. Also the exam is open book.', ""The professor teaches very well, the exercices aren't hard. You have one hard exercice per serie. I would recommend this course. There are recording of the class""]","[""Do the exercises, but it's okay not to focus too much on hard exercises as it's not really asked at the exam."", 'The exam is kind of similar to the exercices, but make sure to understand the concepts beside only knowing how to do the exercices.']"
ME-482,https://edu.epfl.ch/studyplan/en/master/life-sciences-engineering/coursebook/biomechanics-of-the-musculoskeletal-system-ME-482,Biomechanics of the musculoskeletal system,4.5 (2),3.5,2.0,2 (5),['Pioletti'],"[""Good course, the lectures are interesting but do not go into much detail. There is a group project about a real problem encountered in the medical sector, that has to be solved with the assistance of a PhD. The project is very interesting and it gives good insights into the topic, but sometimes you can feel a bit lost, and can be demanding depending on what you decide to do since it's very free (simulations, experiments,...)."", 'I would recommend this course 100%. Easiest 5 credits you can get at EPFL. Each class is taught by a different professor/speaker and is overall interesting.']","['Ask for guidance and help from the scientific assistant for your project (PhD), but also feel free to follow your ideas and what you want to do!', ""Start the project early in the semester so you don't have the stress of the end of the semester""]"
ME-498,https://edu.epfl.ch/studyplan/en/master/management-technology-and-entrepreneurship/coursebook/continuous-improvement-of-manufacturing-systems-ME-498,Continuous improvement of manufacturing systems,5 (2),3.0,2.0,4 (5),['Kaboli'],"['A lot of work but helps to find an internship, really useful\n*sourced from the web', 'Quite a bit of work but less than production management (and easier in terms of concepts)\n*sourced from the web']",[]
ME-523,https://edu.epfl.ch/studyplan/en/master/mechanical-engineering/coursebook/nonlinear-control-systems-ME-523,Nonlinear Control Systems,4.3 (3),4.7,4.0,2.3 (3),['Müllhaupt'],"['I totally recommend because I love the tecaher. The course is really theoretical but clearer when we totally dive into it. It took me some time to do so. The final exam is an oral exam.', ""I recommend because the professor is super nice, you can ask every question, he's super kind with the students. Workload is very low and content is the continuity of control systems."", 'This course is quite heavy on theoretical math for an engineering class, but the teacher is fantastic, so I still recommend it. The topics are interesting, and the instructor genuinely strives to teach the concepts in a way that deepens your intuition. Unfortunately, the course is only available in French.']","[""Redo the lectures at home and really don't hesitate to ask questions. For the exam, find some people in the class and try to help each other."", ""Go to lectures because it is an oral exam so the professor can know you. I haven't done the exercices during the semester because I didn't have time but still I got 5.5 at the exam so it is worth it."", ""The exercises can be quite challenging, but the teacher is known for creating tough problems that are meant to spark curiosity and develop problem-solving skills. It's okay if you need the solutions to work through them. The videos provided by the instructor are good.""]"
ME-524,https://edu.epfl.ch/studyplan/en/master/energy-science-and-technology/coursebook/advanced-control-systems-ME-524,Advanced control systems,3.5 (2),3.5,4.0,3.5 (3),['Karimi'],"['If you enjoy frequency domain controller design methods and want to delve into robust techniques for solving more complex control problems, this course is perfect for you. It involves a significant amount of linear algebra, convex optimization, and linear matrix inequalities, in addition to the core frequency domain robust control theory. The professor is great and often explains concepts intuitively on the blackboard. Attendance is mandatory, as there are no course videos available.', ""I recommend this course if you have a deep knowledge of control theory. Professor doesn't explain deeply but reads the slides... Which in my opinion is not a very good teaching method. Instead I would choose another control course""]","[""The pen-and-paper exercises closely mirror what you'll encounter on the exam. The computer exercises are well-designed and essential for grasping the concepts taught in class, so it's important to complete them carefully."", 'Do the exercices in order to be in shape for the exam.']"
ME-551,https://edu.epfl.ch/studyplan/en/master/energy-science-and-technology/coursebook/engines-and-fuel-cells-ME-551,Engines and fuel cells,3.5 (2),3.0,3.0,3 (4),['Van Herle'],"['Good course to have a revision on engines and fuel cells. The part on engines is fairly easy to understand and doing the series is good enough. However, the part on fuel cells requires more time to understand how to compute the concentration of the different elements. The prof is very slow and watching the videos in x2 is enough to get the notion of the course.', 'Good course to learn the basic of an engine and fuel cell. Not an easy course but the correction of the evalutation is kind.']","['Doing the series is good enough, but for the final exam it is good to have a summary of the more important formulas and also to print all the slides', 'Ask question during the semester. Make a good summary for the evaluation with both math and knowledge.']"
