course_code,course_link,course_name,overall,prof_rating,difficulty,workload,professors,comments,tips
CS-440,https://edu.epfl.ch/studyplan/en/master/communication-systems-master-program/coursebook/advanced-computer-graphics-CS-440,Advanced computer graphics,4.7 (6),4.5,4.0,4.8 (6),['Jakob'],"[""Yes, you will build a ray tracer from scratch, so if you are into computer graphics, it's really cool. I've never done graphics before this class so it's manageable. You need to know some c++, the lectures are super clear but I took it during covid so the lectures were pre-recorded, and well-produced (good image and audio quality). I can't say how the live lectures but the recording videos were great if you could find them."", ""if you're into visual effects and movie making, this course could be fun to take though the workload is super heavy"", ""if you're into visual effects and movie making, this course could be fun to take though the workload is super heavy"", 'a must-take course in EPFL. You should not miss it. But make sure you enjoy it otherwise just quit.', ""Yes. If you are interested in the game or film industry, it provides an opportunity to peek into what's behind them. The final rendering competition is worth attending. It is inspiring and enlightening to see that a lot of students deliver something creative and of high quality."", 'The course is very good and you will probably learn a lot. Wenzel is very good at explaining and I found his lectures interesting. That being said, the course is work intensive. The final project requires an unreasonable amount of time to complete.']","['You will work A LOT!!!! No joke the final project took 30+ hours of work. Be sure to plan and keep up with the homeworks, and give yourself enough time to work on them. It can be tricky to debug but the TAs are super helpful.', ""the individual project takes up a lot of time and effort so make sure you start early (as soon as you go into 2nd half of the semester). some of the renderer features you're asked to implement can be understood by reading the textbook (source code provided too), while some can be more involved and require you to do some research and reading yourself. didn't find the TAs very helpful in my experience."", ""the individual project takes up a lot of time and effort so make sure you start early (as soon as you go into 2nd half of the semester). some of the renderer features you're asked to implement can be understood by reading the textbook (source code provided too), while some can be more involved and require you to do some research and reading yourself. didn't find the TAs very helpful in my experience."", 'At least learn some cpp basics before you take this course.', '1. Take fewer courses along with ACG. The assignments are time-consuming and demanding. Especially the final project is a huge task. 2. Work with a few classmates to learn from each other. If you have not taken the prerequisite course before, it is a bit hard to understand the concepts.', ""The exercises are not too hard and can net you 40%, so I'd suggest putting in the work to get 100 on them.""]"
CS-442,https://edu.epfl.ch/studyplan/en/master/communication-systems-master-program/coursebook/computer-vision-CS-442,Computer vision,4.2 (4),4.8,2.5,2.5 (4),['Fua'],"[""Yes, if you want to learn the classical methods of computer vision. Professor Fua is an engaging professor, and he adapts the material to the newest technologies so it might not be sufficient to just watch lecture recordings. I wish I had gone to lectures more often. The methods presented, like hough transforms, are super fun. The slides are a bit vague and if you didn't go to lectures, but only read the slides, it's hard to understand well."", ""Yes, especially if you are interested in CV. The homeworks / exercises were fun, and I appreciated that it's not just machine learning, and that we learned classical algorithms."", 'Helps to understand basic concepts which we usually skip :D So if you want to continue in this area, take it.', ""Pretty challenging if you have absolutely no prior knowledge in machine learning and camera basics. However it's still manageable if you're willing to spend some time to study - I took it as a 2nd year undergrad exchange student and I passed it fine.""]","['1. One youtube channel saved me, called ""first principles of computer vision"" by a prof at Columbia University. He explained everything super clearly (even more so than Prof. Fua) 2. The exercises are important, and there were 2 graded exercises when I took it -- make sure your python environment is ready, familiarize yourself with numpy manipulations, it\'s almost impossible to finish all those graded exercises in time. 3. The final exam is mostly multiple choice -- you don\'t need to remember the formulas, but you need to understand what are the variables and how, on the higher level, they affect each other. Machine learning will help greatly with this class, although I didn\'t have the background and still did well.', 'Make sure you understand the algorithms. One of the exam questions was to ""debug"" a python code.', ""Exercise session are easy if you are good with writing algorithms. For exam, I just watched the lecture recordings (slides are explained well in the recordings) and solved previous exams. Other than that, didn't do anything :)"", ""The graded exercises are insanely hard in my opinion, impossible to finish everything in time. Good thing is they don't account for too much of your final grade. Expect the final exam to be harder and in greater details than the mock exams you are given! The final exam will be heavily curved... My self grading yielded a raw score of 55% but my final grade was much, much, much higher than that :)""]"
CS-444,https://edu.epfl.ch/studyplan/en/master/communication-systems-master-program/coursebook/virtual-reality-CS-444,Virtual reality,4.6 (5),4.0,2.4,4 (4),['Boulic'],"['2022: The project is in Unity , discord as discussion forum. Not a lot of guidance. Start your project early! Unity is fickle and you need some experience to work around its bugs, and time to ask for help\n*sourced from the web', 'Yes I thoroughly enjoyed the class. The whole class is project-based, you make a VR game during the semester. Each group (of 3) is given a headset to test on that we get to keep throughout the semester. The lectures are quite theoretical and could be more dense, but some ideas are indeed interesting (like what makes a player enter into the state of ""flow""). It\'s really sad that you won\'t get to play other groups\' games at the end though.', 'Yes I thoroughly enjoyed the class. The whole class is project-based, you make a VR game during the semester. Each group (of 3) is given a headset to test on that we get to keep throughout the semester. The lectures are quite theoretical and could be more dense, but some ideas are indeed interesting (like what makes a player enter into the state of ""flow""). It\'s really sad that you won\'t get to play other groups\' games at the end though.', ""Yes if you want to program a lot + have some fun with VR. I didn't go to a single lecture cuz I find the whole field of HCI a bit vague, but going to the lectures will be helpful for your final oral exam where the prof tests you on random graphs / concepts. The course itself is mainly project based -- you will form a team and make a VR game with unity. It's loads of fun."", 'It is an easy to pass course if you stick to the base requirements, but it is making a VR game so you can pour tons lf hours making it as good as possible if you want a great grade.']","[""The TAs are super helpful, they all love VR, are super kind and would help you debug if needed. I'd also say that working on separate times is more preferable than working together and merging, as merging the assets / scene can cause some problems. The headset is very much necessary for testing so it's best if each person gets to keep it for a few days and you rotate between yourselves."", ""The TAs are super helpful, they all love VR, are super kind and would help you debug if needed. I'd also say that working on separate times is more preferable than working together and merging, as merging the assets / scene can cause some problems. The headset is very much necessary for testing so it's best if each person gets to keep it for a few days and you rotate between yourselves."", ""Start early on the project. Play some VR games ahead of time to know what kind of game you want to build. If you know unity amazing, if not the TAs are helpful. It's really just lots of fun coding so enjoy! Btw, unity environment set up is really a pain in the ass so make sure you dedicate enough time so that the whole team could work smoothly with git + git lfs. Also the best way to work is each person works at a separate time because resolving unity git conflicts is not easy. Jetbrains help :D"", 'Make sure you know everything in the slides and you can get a perfect score on the oral exam.']"
CS-448,https://edu.epfl.ch/studyplan/en/master/communication-systems-master-program/coursebook/sublinear-algorithms-for-big-data-analysis-CS-448,Sublinear algorithms for big data analysis,4.5 (3),4.5,4.5,3.5 (4),[],"[""It was last taught in spring 2019, so I don't know if there's someone here who can give feedback. However I guess the structure and approach will be the same as in kapralov's other courses, so you should expect a very mathy class: algorithm-theorem-proof, on loop for the whole semester. You'll most likely enjoy it if you're into algorithms and theoretical cs (and math). Also in my experience his courses were more time demanding than what credits suggested. Kapralov is super passionate and a good lecturer, although he tends to forget that we're not all as smart as he is😅\n*sourced from the web"", 'Good luck for that course, Kapralov likes them math-heavy\n*sourced from the web', 'Yes I definitely would recommend it. The last time the class was taught was in 2021 when I took it. I do not regret it. Of course it’s Kapralov, so the subject and exercises are super difficult but he explains everything incredibly well. One thing I also appreciated a lot and that should not be neglected is the fact that the exam was a take home. Since problems are more difficult, he gives you time to work on them at home which is really helpful. Finally we don’t have to spit out everything that we know in 3 hours. Definitely a go to if you like Theoretical CS.']",['Go to lectures and do all exercises. The graded homeworks and the final exam are much more complex and difficult but they can be done if you followed correctly during the semester.']
CS-450,https://edu.epfl.ch/studyplan/en/master/communication-systems-master-program/coursebook/advanced-algorithms-CS-450,Advanced algorithms,4.8 (14),4.7,4.6,3.7 (8),"['Chiesa', 'Kapralov']","['The material is very interesting but the exam was very frightening\n*sourced from the web', 'The course is really interesting. It was quite different than the ""classic"" algorithm courses I took before in the sense that (a lot of) probability and approximation is involved. For me this complicated the reasoning about algorithms, which was pretty much combinatorics until now. The lecture notes are really good and match what is said in class perfectly. And the exam was horrible\n*sourced from the web', ""I don't about how difficult the final exam of advanced Algorithms was, but the teacher and the course are amazing, don't get discouraged\n*sourced from the web"", ""Michael is incredibly smart, and he cares about his students understanding the material. However, sometimes he went too fast and too many steps ahead and it's a little hard to follow. He brings a lot of energy to class and it's super fun to attend."", ""You don't do advanced algo for the grade, you do it for the experience 🥰"", ""Still regarding advance Algo, be aware that the second half of the course is significantly harder than the first. That, said I think the topics are very cool and I would take it again despite my grade was not so good even though I spent really a lot of time studying it. I agree with people above that it does not really help for coding interview. The algorithms studied are often simple ones. It is the analysis that gets harder since it's usually probabilistic and often involves proving approximation guarantees rather than correctness.\n*sourced from the web"", 'I think the main background class you need is CS-250 Algorithms (but personally I did not even follow it) The midterm is very difficult and the 2 homeworks are difficult but doable in group of 3 Last year the final exam was on the last day of exam period so there was time to prepare It takes a lot of time to understand the theory but I would say it is a very interesting course\n*sourced from the web', 'I have two years ago. The course material was really interesting, but it was a lot of work (always is when Kapralov gives the course).\n*sourced from the web', 'I think that the content of the lectures is interesting. The general idea of the course (in my opinion) is to prove some performance boundaries for different randomised algotithms.\n*sourced from the web', 'I definitely would. The content is interesting, and the professor (at the time it was Kapralov by itself) is amazing. However, it’s pretty difficult. The thing is, there is a lot of material to understand. And, it moves fast. You should be familiar with basic algorithmic techniques and structures and with probabilistic tools. The difficult part is not really using the algorithms or creating them, it’s more proving their correctness. If you attend the lectures, work on the exercises correctly and study for the final exam, it should be fine for you. Please note that the exams and homeworks are difficult. You will spend some time on them. And finally, if you find yourself not understanding most of the material after the first half of the semester, do not panic, I went through this and passed the course :p', 'Yes if you like the theory and mathematical aspect of algorithms', ""I've you searching for a intellectual challenge, you get there what you want. Else it is too much effort for such a course. And I don't see the big advantages in practice."", 'I would recommend this course if you are interested in theory', ""Hard class, not for the slackers. Grade was heavily curved when I took it (+0.5/6) and it was Svenson. Both Svenson and Kapralov are great passionate professors who know what they're talking about, you will learn a lot and this class will expand your view on algorithms in general. You need to view this class as an algorthmic toolbox, it moves fast from one topic to another with sometimes little to no link inbetween, it's normal, the goal is for you to acquire the knowledge to solve different types of problems that may arise in very high level engineering where you have restricted memory and latency constraints (think google processing huge loads of data with limited server capacity, this course will teach you how they do it). However problem sheets are HARD, homeworks are HARD and the exam is SCARY, but you'll get through it. Most useful class you'll ever take at EPFL, but not one you should take just for the credits.""]","[""Absolutely go to the exercises sessions. The TAs walk through the problems. Even if you can't solve them on your own, you absorb some of the ideas for the exams. There was one final exam and two graded homeworks. You can collaborate on the homeworks. For the exam, there is always one easy question. I heard that if you can do that question + get a few points elsewhere, you will pass."", 'I guess if you work enough, understand well the content, got some good inspiration during the exam and pray the Gaussian god enough (before and after the exam), you can have a good grade 👌🏼 A bit more seriously, if you have already some good backgrounds in algorithm and already have the « good » way of thinking for such problems it will help, otherwise you may need extra work to develop it throughout the semester', 'I’d suggest being comfortable with discrete math, probability and mathematical reasoning. Also, finding algorithms to solve given problems is not that difficult in my opinion, however proving their correctness is on another level (especially for randomised procedures) :p\n*sourced from the web', 'The exams weren’t that hard, because in my opinion criterions for proving correctness weren’t that strict (compare to algorithms CS250). It is important to learn patterns from lecture/exercises to pass the final. If you do it, everythink might be okay I guess:)\n*sourced from the web', 'Lectures are important and exercise sessions are really helpful. If you work regularly and don’t panic on the exam, it should be fine !', 'Practice on blank/previous exams. Aim to get maximum points on the homeworks.', ""Make as much points as possible in the labs. If you have not much points in the exam, this doesn't mean that you didn't pass the course."", 'Nothing to do in addition to exercises and study final exams', ""Always go to lectures and ask questions, always go to exercise sessions and do the problems on time + ask questions, if you have conflicts maybe don't take the class because it's too time-consuming to self-study.""]"
CS-451,https://edu.epfl.ch/studyplan/en/master/communication-systems-master-program/coursebook/distributed-algorithms-CS-451,Distributed algorithms,4.4 (9),4.4,3.0,2.6 (8),['Guerraoui'],"['The problem of the DA project is not really the code itself but understanding what they want and the algorithms that you need to use\n*sourced from the web', 'Completely in my opinion, DA was a great course (despite the lab not the clearest, these were fairly simple and you could ask teacher/TA for precisions, and the exam was as announced, 60% they check that you worked and the rest you have to think and resolve problems) and DSE to avoid at any cost (an awful workload with unclear project where you end up trying every possible way to interprete the handout to get the tests passing)\n*sourced from the web', ""J'ai également pris ce cours ainsi que concurrent algorithm. Je trouve les cours très intéressants. En ce qui concerne les exos, les TA étaient vraiment bien pour Distributed. Pour Concurrent je suis assez mitigé. Finalement pour les deux projets, je trouve qu'il y a très peu d'explications sur comment entreprendre le projet et les TA sont pas incroyable. Ca serait vraiment bien si le projet de distributed algo pouvait être réalisé en Rust.\n*sourced from the web"", 'J\'ai pris distributed algo (je ne sais pas pour combien de temps encore). Le prof est super, il a de l\'humour, mais pas le genre ""In your face"". Ses blagues sont suffisamment discrètes et bien espacées pour apporter de la légèreté au tout sans freiner le rythme du cours. J\'aime ce type. Les TAs d\'exercices font ce qu\'ils peuvent avec le peu de temps qui leur est alloué (Il n\'y a eu que 2 séances d\'exercices alors je ne peux pas trop dire). Les TAs de projets... Disons que le projet est TRES PEU guidé (pas un seul commentaire dans le template fourni, pas de marche à suivre, pas de rien, aucune indication des TAs qui se contentent de te fixer en te disant ""c\'est facile, c\'est ce que vous voyez en cours""). Bref : soit tu sais déjà faire et tout va bien, soit tu sais rien et à ce moment-là, ait la décence (et l\'esprit d\'écologie) d\'éteindre la lumière avant de mourir.\n*sourced from the web', ""Je prends les deux cours[DA & CA], mais surtout en concurrent algo. Le projet a un handout assez complet sur les bases à connaître et ce qu'il faut faire, mais ne dit rien du tout sur comment approcher la chose (même si l'assistant du projet est plein de bonne volonté). Ce qu'on voit en cours est très théorique (des réductions qui servent à faire des preuves) mais ça n'a pas du tout l'air d'être directement applicable au projet : ce sont des constructions intéressantes mais inefficaces qui m'ont l'air d'être surtout bonnes à faire des preuves. Du coup bah je sais pas par où commencer, j'ai toujours fait du concurrent programming avec des locks ou bien du compare-and-set, et j'arrive pas du tout à raccommoder les bouts. On ne nous dit même pas de faire une implémentation lock-free, on nous dit juste de faire ce qu'on veut. Donc ça veut dire qu'il est plus naturel pour moi de faire une implémentation qui repose sur des principes que je connais déjà bien, plutôt que de trouver tout seul comment diable appliquer le cours pour faire une vraie transactional memory qui serait plus efficace qu'une implémentation lock-based\n*sourced from the web"", 'The content of the class is very useful, modern code is very distributed and concurrent. You have to think differently from serial code.', 'The course overall is good. Theoretical in nature. Lays a good foundation of the distributed algorithms. Exercise TAs are very responsive and helpful. The book is clear but sometimes differs from what is presented in the lectures which causes confusion. The lecture slides are quite bad and the professor knows it but ignores all requests to improve them. The project is an absolute disaster. Lab TAs are unprepared or straight up refuse to answer questions because ""this is for you to figure out"". Project has strict limits but the evaluation does not respect them. Evaluation is a black box done by TAs. The evaluation process is supposedly automated, yet you will get your grades for each milestone late, or not at all. The grade depends on your speed relative to other students which promotes endless optimization because there is no reference solution you should be aiming towards.', 'I did not find the content super interesting, however, Rachid has good jokes and goes on weird tangents in his lectures. This made the lectures quite enjoyable. Also, the project is not too hard and the exam was easy.', '- A very theoretical course about distributed algorithms that couples well with the Concurrent Computing course (also given by the same prof.). Many algorithms are presented and thoroughly explained, and some proofs are made - The prof. Rachid is spectacular in explaining, he’s like a storyteller talking about the contents of the. One of the best on EPFL so far. The classes are recorded as well - It was a project (30%) + exam (70%) course, - The project was about implementing 3 different distributed algorithms (in 3 milestones) using either Java or C++. I think it was a fair amount of work, even given that I went with C++ as I wanted to learn more about the language. You need to think well about what want to do and how to do it before implementing it, as it might be a bit difficult to debug, since you’ll be making different processes communicate - The exam was, as expected, very theoretical but the questions scaled in difficulty. They started with easy ones that were discussed in class or in the exercise sessions and progressively increased their difficulty. Still, not being a fan of theory courses myself, I found it difficult despite having started fully studying for it 2 weeks before. I probably failed it given my final grade. - Even if you are not a fan of theory, I’d recommend as the way Rachid explains will make you understand and really like the contents of it. The project is also cool and gives you a good perspective of how distributed algorithms can be implemented. The only downside/spooky part is the exam, but I’d say that you can prepare yourself well for it.']","[""For the project, if your code runs, you get a 4, and then it's ranked by how fast it is. The fastest person gets a 6. It's a bit stressful and unfair."", 'Memorize algorithms and master the ability to write hand-wavy proofs that are not necessarily logically sound and you will be fine. Use slides only as guidance for finding the topic in the book.', ""You don't have to do much work, but I'd suggest revising a bit before each lecture, because it is easy to get lost if you forget stuff from the previous lectures"", 'For the exam, do a lot of exercises and go to the exercise sessions, so that you can really understand the theory behind it.']"
